Symbol,Name,Last Sale,Net Change,% Change,Market Cap,Country,IPO Year,Volume,Sector,Industry
A,Agilent Technologies Inc. Common Stock,$139.65,2.78,2.031%,40125309255.00,United States,1999,1795434,Industrials,Biotechnology: Laboratory Analytical Instruments
AA,Alcoa Corporation Common Stock ,$40.73,0.16,0.394%,10522792144.00,United States,2016,2930997,Industrials,Aluminum
AACG,ATA Creativity Global American Depositary Shares,$1.04,0.03,2.97%,33280135.00,China,2008,64843,Real Estate,Other Consumer Services
AACT,Ares Acquisition Corporation II Class A Ordinary Shares,$10.87,-0.005,-0.046%,0.00,,2023,26869,Finance,Blank Checks
AADI,Aadi Bioscience Inc. Common Stock,$1.96,-0.03,-1.508%,48245075.00,United States,,24640,Health Care,Biotechnology: Pharmaceutical Preparations
AAL,American Airlines Group Inc. Common Stock,$12.99,-0.55,-4.062%,8536131638.00,United States,,25654132,Consumer Discretionary,Air Freight/Delivery Services
AAM,AA Mission Acquisition Corp. Class A Ordinary Shares,$10.05,0.00,0.00%,0.00,,2024,2845,,
AAME,Atlantic American Corporation Common Stock,$1.68,0.05,3.067%,34271593.00,United States,,877,Finance,Life Insurance
AAOI,Applied Optoelectronics Inc. Common Stock,$16.40,-0.44,-2.613%,670689726.00,United States,2013,1912132,Technology,Semiconductors
AAON,AAON Inc. Common Stock,$112.46,-1.01,-0.89%,9110738624.00,United States,,258765,Industrials,Industrial Machinery/Components
AAP,Advance Auto Parts Inc.,$37.45,1.20,3.31%,2234801936.00,United States,,3402987,Consumer Discretionary,Auto & Home Supply Stores
AAPL,Apple Inc. Common Stock,$222.01,-0.90,-0.404%,3355863864230.00,United States,1980,44944468,Technology,Computer Manufacturing
AAT,American Assets Trust Inc. Common Stock,$27.13,0.49,1.839%,1652259947.00,United States,2011,214724,Real Estate,Real Estate Investment Trusts
AB,AllianceBernstein Holding L.P.  Units,$36.11,-1.32,-3.527%,4096150741.00,United States,,322488,Finance,Investment Managers
ABAT,American Battery Technology Company Common Stock,$1.00,0.0067,0.675%,72048442.00,United States,,505792,Basic Materials,Metal Mining
ABBV,AbbVie Inc. Common Stock,$200.47,-3.08,-1.513%,354098930560.00,United States,2012,3531804,Health Care,Biotechnology: Pharmaceutical Preparations
ABCB,Ameris Bancorp Common Stock,$61.23,-0.87,-1.401%,4228973573.00,United States,1994,248529,Finance,Major Banks
ABCL,AbCellera Biologics Inc. Common Shares,$2.89,0.16,5.861%,851583387.00,Canada,2020,3645421,Health Care,Pharmaceuticals and Biotechnology
ABEO,Abeona Therapeutics Inc. Common Stock,$6.04,-0.21,-3.36%,261618958.00,United States,,433523,Health Care,Biotechnology: Pharmaceutical Preparations
ABEV,Ambev S.A. American Depositary Shares (Each representing 1 Common Share),$2.21,0.06,2.791%,34815971558.00,Brazil,2013,20246093,Consumer Staples,Beverages (Production/Distribution)
ABG,Asbury Automotive Group Inc Common Stock,$236.98,9.00,3.948%,4641836034.00,United States,2002,251348,Consumer Discretionary,Retail-Auto Dealers and Gas Stations
ABL,Abacus Life Inc. Class A Common Stock,$8.63,0.09,1.054%,644241125.00,United States,2020,16724,Finance,Investment Managers
ABLLL,Abacus Life Inc. 9.875% Fixed Rate Senior Notes due 2028,$26.8499,0.4499,1.704%,2004381202.00,United States,,3669,Finance,Investment Managers
ABLLW,Abacus Life Inc. Warrant,$1.33,-0.06,-4.317%,99286292.00,United States,2020,4575,Finance,Investment Managers
ABLV,Able View Global Inc. Class B Ordinary Shares,$0.92,0.01,1.099%,38970494.00,China,,585,Consumer Discretionary,Other Consumer Services
ABM,ABM Industries Incorporated Common Stock,$54.18,1.09,2.053%,3402030413.00,United States,,213655,Finance,Diversified Commercial Services
ABNB,Airbnb Inc. Class A Common Stock,$136.87,0.41,0.30%,87819003655.00,United States,2020,2459746,Finance,Diversified Commercial Services
ABOS,Acumen Pharmaceuticals Inc. Common Stock,$2.95,0.105,3.691%,177235345.00,United States,2021,198629,Health Care,Biotechnology: Biological Products (No Diagnostic Substances)
ABR,Arbor Realty Trust Common Stock,$14.70,-0.14,-0.943%,2772549022.00,United States,2004,2780815,Real Estate,Real Estate Investment Trusts
ABR^D,Arbor Realty Trust 6.375% Series D Cumulative Redeemable Preferred Stock Liquidation Preference $25.00 per Share,$19.10,0.10,0.526%,,United States,,30166,,
ABR^E,Arbor Realty Trust 6.25% Series E Cumulative Redeemable Preferred Stock,$19.50,0.0004,0.002%,,United States,,4271,,
ABR^F,Arbor Realty Trust 6.25% Series F Fixed-to-Floating Rate Cumulative Redeemable Preferred Stock Liquidation Preference $25.00 per share,$20.22,-0.30,-1.462%,,United States,,28369,,
ABSI,Absci Corporation Common Stock,$4.00,0.08,2.041%,454225336.00,United States,2021,702187,Health Care,Biotechnology: Commercial Physical & Biological Resarch
ABT,Abbott Laboratories Common Stock,$117.65,-0.95,-0.801%,204058655809.00,United States,,5603975,Health Care,Biotechnology: Pharmaceutical Preparations
ABTS,Abits Group Inc Ordinary Shares,$0.5757,0.0257,4.673%,20468828.00,China,,37644,Technology,Computer Software: Programming Data Processing
ABUS,Arbutus Biopharma Corporation Common Stock,$3.87,-0.09,-2.273%,730586452.00,Canada,,944765,Health Care,Biotechnology: Pharmaceutical Preparations
ABVC,ABVC BioPharma Inc. Common Stock,$0.6313,-0.0287,-4.348%,7841892.00,United States,,151862,Health Care,Biotechnology: Pharmaceutical Preparations
ABVE,Above Food Ingredients Inc. Common Stock,$0.3828,0.0018,0.472%,10643604.00,Canada,,75510,Consumer Staples,Packaged Foods
ABVEW,Above Food Ingredients Inc. Warrants,$0.0248,-0.0046,-15.646%,689554.00,Canada,,32964,Consumer Staples,Packaged Foods
ABVX,Abivax SA American Depositary Shares,$10.55,0.28,2.726%,663779403.00,France,2023,33187,Health Care,Biotechnology: Pharmaceutical Preparations
AC,Associated Capital Group Inc. Common Stock,$35.55,-0.45,-1.25%,756168586.00,United States,2015,8376,Finance,Investment Bankers/Brokers/Service
ACA,Arcosa Inc. Common Stock ,$95.66,1.97,2.103%,4665990410.00,United States,2018,345377,Industrials,Metal Fabrications
ACAB,Atlantic Coastal Acquisition Corp. II Class A Common Stock,$11.49,-0.06,-0.519%,0.00,United States,2022,1168,Finance,Blank Checks
ACABU,Atlantic Coastal Acquisition Corp. II Unit,$12.54,0.00,0.00%,0.00,United States,2022,10,Finance,Blank Checks
ACAD,ACADIA Pharmaceuticals Inc. Common Stock,$14.62,-0.19,-1.283%,2425107880.00,United States,1985,2793839,Health Care,Biotechnology: Pharmaceutical Preparations
ACB,Aurora Cannabis Inc. Common Shares,$5.98,0.44,7.942%,326871446.00,Canada,,1525946,Health Care, Medicinal Chemicals and Botanical Products 
ACCD,Accolade Inc. Common Stock,$3.15,-0.05,-1.563%,253691802.00,United States,2020,878961,Consumer Discretionary,Business Services
ACCO,Acco Brands Corporation Common Stock,$5.56,0.30,5.703%,516418404.00,United States,,900789,Consumer Discretionary,Publishing
ACDC,ProFrac Holding Corp. Class A Common Stock,$6.24,0.28,4.698%,999314796.00,United States,2022,767819,Energy,Oilfield Services/Equipment
ACEL,Accel Entertainment Inc. ,$11.03,0.01,0.091%,908248331.00,United States,2017,205364,Consumer Discretionary,Services-Misc. Amusement & Recreation
ACET,Adicet Bio Inc. Common Stock ,$1.26,0.01,0.80%,103825210.00,United States,2018,477366,Health Care,Biotechnology: Pharmaceutical Preparations
ACGL,Arch Capital Group Ltd. Common Stock,$95.00,-1.02,-1.062%,35725494895.00,Bermuda,,2293361,Finance,Property-Casualty Insurers
ACGLN,Arch Capital Group Ltd. Depositary Shares each Representing a 1/1000th Interest in a 4.550% Non-Cumulative Preferred Share Series G,$20.64,0.385,1.901%,7761833838.00,Bermuda,,45564,Finance,Property-Casualty Insurers
ACGLO,Arch Capital Group Ltd. Depositary Shares Each Representing 1/1000th Interest in a Share of 5.45% Non-Cumulative Preferred Shares Series F,$23.55,0.15,0.641%,8856162156.00,Bermuda,,25537,Finance,Property-Casualty Insurers
ACHC,Acadia Healthcare Company Inc. Common Stock,$42.33,0.31,0.738%,3931836950.00,United States,,2319677,Health Care,Medical Specialities
ACHL,Achilles Therapeutics plc American Depositary Shares,$1.025,0.005,0.49%,42110022.00,United Kingdom,2021,60941,Health Care,Biotechnology: Biological Products (No Diagnostic Substances)
ACHR,Archer Aviation Inc. Class A Common Stock,$3.24,-0.04,-1.22%,1151993525.00,United States,2020,8620143,Industrials,Aerospace
ACHV,Achieve Life Sciences Inc. Common Shares,$4.74,0.03,0.637%,162777776.00,United States,,52919,Health Care,Biotechnology: In Vitro & In Vivo Diagnostic Substances
ACI,Albertsons Companies Inc. Class A Common Stock,$18.45,-0.21,-1.125%,10688972058.00,United States,2020,2195149,Consumer Staples,Food Chains
ACIC,American Coastal Insurance Corporation Common Stock,$11.94,-0.36,-2.927%,574858249.00,United States,,176068,Finance,Property-Casualty Insurers
ACIU,AC Immune SA Common Stock,$2.94,-0.06,-2.00%,291641617.00,Switzerland,2016,84079,Health Care,Biotechnology: Pharmaceutical Preparations
ACIW,ACI Worldwide Inc. Common Stock,$50.15,0.66,1.334%,5248561439.00,United States,,460145,Technology,Computer Software: Prepackaged Software
ACLS,Axcelis Technologies Inc. Common Stock,$85.16,-0.93,-1.08%,2777713709.00,United States,2000,419000,Technology,Industrial Machinery/Components
ACLX,Arcellx Inc. Common Stock,$86.44,0.27,0.313%,4646640893.00,United States,2022,784410,Health Care,Biotechnology: Biological Products (No Diagnostic Substances)
ACM,AECOM Common Stock,$108.04,-0.36,-0.332%,14484571238.00,United States,2007,575390,Consumer Discretionary,Military/Government/Technical
ACMR,ACM Research Inc. Class A Common Stock,$18.56,0.01,0.054%,1159458493.00,United States,2017,1225086,Technology,Industrial Machinery/Components
ACN,Accenture plc Class A Ordinary Shares (Ireland),$343.90,-1.77,-0.512%,214993693948.00,Ireland,2001,1931315,Consumer Discretionary,Business Services
ACNB,ACNB Corporation Common Stock,$41.79,0.15,0.36%,357121836.00,United States,,7775,Finance,Major Banks
ACNT,Ascent Industries Co. Common Stock,$9.50,0.10,1.064%,96185002.00,United States,,29079,Industrials,Steel/Iron Ore
ACON,Aclarion Inc. Common Stock,$0.1836,-0.0015,-0.81%,1764396.00,United States,2022,287865,Health Care,Medical Specialities
ACONW,Aclarion Inc. Warrant,$0.0269,-0.0008,-2.888%,258509.00,United States,2022,5901,Health Care,Medical Specialities
ACP,abrdn Income Credit Strategies Fund Common Shares,$6.42,-0.02,-0.311%,0.00,United States,2011,1024903,Finance,Investment Managers
ACP^A,abrdn Income Credit Strategies Fund 5.250% Series A Perpetual Preferred Stock,$24.085,0.6118,2.606%,,United States,,1564,,
ACR,ACRES Commercial Realty Corp. Common Stock,$15.72,0.33,2.144%,123767207.00,United States,,19824,Real Estate,Real Estate Investment Trusts
ACR^C,ACRES Commercial Realty Corp. 8.625% Fixed-to-Floating Series C Cumulative Redeemable Preferred Stock ,$24.90,0.01,0.04%,,United States,,12873,,
ACR^D,ACRES Commercial Realty Corp. 7.875% Series D Cumulative Redeemable Preferred Stock,$22.90,-0.18,-0.78%,,United States,,3133,,
ACRE,Ares Commercial Real Estate Corporation Common Stock,$6.30,-0.03,-0.474%,343467980.00,United States,2012,511297,Real Estate,Real Estate Investment Trusts
ACRS,Aclaris Therapeutics Inc. Common Stock,$2.17,0.08,3.828%,154817689.00,United States,2015,1803591,Health Care,Biotechnology: Pharmaceutical Preparations
ACRV,Acrivon Therapeutics Inc. Common Stock,$7.85,-0.16,-1.998%,243131480.00,United States,2022,35765,Health Care,Biotechnology: Pharmaceutical Preparations
ACT,Enact Holdings Inc. Common Stock,$32.42,0.04,0.124%,5047739372.00,United States,2021,763475,Finance,Specialty Insurers
ACTG,Acacia Research Corporation (Acacia Tech) Common Stock,$4.36,-0.23,-5.011%,437637001.00,United States,,503615,Miscellaneous,Multi-Sector Companies
ACTU,Actuate Therapeutics Inc. Common stock,$8.77,0.94,12.005%,171292448.00,United States,2024,35646,Health Care,Biotechnology: Pharmaceutical Preparations
ACU,Acme United Corporation. Common Stock,$38.87,-0.79,-1.992%,143623328.00,United States,1988,26806,Consumer Discretionary,Industrial Machinery/Components
ACV,Virtus Diversified Income & Convertible Fund Common Shares of Beneficial Interest,$20.68,0.035,0.17%,214305889.00,United States,2015,35480,Finance,Finance/Investors Services
ACVA,ACV Auctions Inc. Class A Common Stock,$17.25,0.21,1.232%,2873617022.00,United States,2021,971496,Consumer Discretionary,Business Services
ACXP,Acurx Pharmaceuticals Inc. Common Stock,$1.85,-0.01,-0.538%,30053433.00,United States,2021,54154,Health Care,Biotechnology: Pharmaceutical Preparations
ADAG,Adagene Inc. American Depositary Shares,$3.05,0.05,1.667%,134555847.00,China,2021,14303,Health Care,Biotechnology: Pharmaceutical Preparations
ADAP,Adaptimmune Therapeutics plc American Depositary Shares,$0.8275,0.0277,3.463%,211624850.00,United Kingdom,2015,1237685,Health Care,Biotechnology: Biological Products (No Diagnostic Substances)
ADBE,Adobe Inc. Common Stock,$481.35,-1.45,-0.30%,211890270000.00,United States,1986,1955249,Technology,Computer Software: Prepackaged Software
ADC,Agree Realty Corporation Common Stock,$74.00,0.07,0.095%,7660678098.00,United States,,826764,Real Estate,Real Estate Investment Trusts
ADC^A,Agree Realty Corporation Depositary Shares each representing 1/1000th of a 4.250% Series A Cumulative Redeemable Preferred Stock,$19.52,0.1076,0.554%,,United States,,8205,,
ADCT,ADC Therapeutics SA Common Shares,$3.02,0.07,2.373%,291875299.00,Switzerland,2020,363823,Health Care,Biotechnology: Pharmaceutical Preparations
ADD,Color Star Technology Co. Ltd. Class A Ordinary Shares,$0.165,0.0088,5.634%,10141510.00,United States,,1279294,Consumer Discretionary,Engineering & Construction
ADEA,Adeia Inc. Common Stock,$12.54,0.07,0.561%,1365638742.00,United States,2003,277884,Technology,Computer Software: Prepackaged Software
ADGM,Adagio Medical Holdings Inc Common Stock,$2.71,-0.005,-0.184%,36280494.00,United States,,2497,Health Care,Medical/Dental Instruments
ADI,Analog Devices Inc. Common Stock,$224.19,-1.29,-0.572%,111308867676.00,United States,,1599638,Technology,Semiconductors
ADIL,Adial Pharmaceuticals Inc Common Stock,$1.005,-0.005,-0.495%,6435398.00,United States,2018,37303,Health Care,Biotechnology: Pharmaceutical Preparations
ADM,Archer-Daniels-Midland Company Common Stock,$55.30,0.66,1.208%,26441254148.00,United States,,2459354,Consumer Staples,Packaged Foods
ADMA,ADMA Biologics Inc Common Stock,$19.11,-0.26,-1.342%,4454212824.00,United States,,4536800,Health Care,Biotechnology: Biological Products (No Diagnostic Substances)
ADN,Advent Technologies Holdings Inc. Class A Common Stock,$3.35,1.45,76.316%,8832302.00,United States,2018,66854558,Miscellaneous,Industrial Machinery/Components
ADNT,Adient plc Ordinary Shares ,$19.74,-0.08,-0.404%,1721129277.00,United States,2016,1097984,Consumer Discretionary,Auto Parts:O.E.M.
ADNWW,Advent Technologies Holdings Inc. Warrant,$0.0101,0.0002,2.02%,26629.00,United States,2018,1227538,Miscellaneous,Industrial Machinery/Components
ADP,Automatic Data Processing Inc. Common Stock,$289.86,1.68,0.583%,118105457324.00,United States,,1184322,Technology,EDP Services
ADPT,Adaptive Biotechnologies Corporation Common Stock,$5.26,-0.05,-0.942%,775703777.00,United States,2019,1160205,Health Care,Biotechnology: Biological Products (No Diagnostic Substances)
ADSE,ADS-TEC ENERGY PLC Ordinary Shares,$13.89,-0.19,-1.349%,702622358.00,Ireland,,30137,Consumer Discretionary,Industrial Specialties
ADSEW,ADS-TEC ENERGY PLC Warrant,$3.25,-0.19,-5.523%,164400480.00,Ireland,,238,Consumer Discretionary,Industrial Specialties
ADSK,Autodesk Inc. Common Stock,$287.62,1.05,0.366%,61838300000.00,United States,,896358,Technology,Computer Software: Prepackaged Software
ADT,ADT Inc. Common Stock,$7.32,0.07,0.966%,6639338044.00,United States,2018,7876323,Consumer Discretionary,Diversified Commercial Services
ADTN,ADTRAN Holdings Inc. Common Stock,$6.20,0.02,0.324%,491238691.00,United States,1994,334794,Utilities,Telecommunications Equipment
ADTX,Aditxt Inc. Common Stock,$0.49,-0.0399,-7.53%,66011.00,United States,2020,1622681,Health Care,Biotechnology: Pharmaceutical Preparations
ADUS,Addus HomeCare Corporation Common Stock,$128.96,2.69,2.13%,2334212754.00,United States,2009,206283,Health Care,Medical/Nursing Services
ADV,Advantage Solutions Inc. Class A Common Stock,$3.23,0.02,0.623%,1035339048.00,United States,2019,258908,Consumer Discretionary,Business Services
ADVM,Adverum Biotechnologies Inc. Common Stock,$7.54,0.13,1.754%,156838809.00,United States,2014,127563,Health Care,Biotechnology: Biological Products (No Diagnostic Substances)
ADVWW,Advantage Solutions Inc. Warrant,$0.025,-0.0055,-18.033%,8013460.00,United States,2019,2454,Consumer Discretionary,Business Services
ADX,Adams Diversified Equity Fund Inc.,$21.63,-0.10,-0.46%,0.00,United States,,258342,Finance,Investment Managers
ADXN,Addex Therapeutics Ltd American Depositary Shares,$10.96,0.26,2.43%,11434513.00,Switzerland,,53418,Health Care,Biotechnology: Pharmaceutical Preparations
AE,Adams Resources & Energy Inc. Common Stock,$27.50,0.59,2.192%,70611750.00,United States,1980,6960,Energy,Oil Refining/Marketing
AEE,Ameren Corporation Common Stock,$86.02,0.14,0.163%,22951574685.00,United States,,1808211,Utilities,Power Generation
AEF,abrdn Emerging Markets Equity Income Fund Inc. Common Stock,$5.40,0.04,0.746%,579757500.00,United States,,55441,Finance,Finance/Investors Services
AEFC,Aegon Funding Company LLC 5.10% Subordinated Notes due 2049,$21.9024,0.3024,1.40%,0.00,United States,2019,21802,,
AEG,Aegon Ltd. New York Registry Shares,$6.35,0.03,0.475%,13998487065.00,Netherlands,,3409990,Finance,Life Insurance
AEHL,Antelope Enterprise Holdings Limited Class A Ordinary Shares,$0.276,-0.019,-6.441%,2448291.00,China,,903711,Industrials,Building Materials
AEHR,Aehr Test Systems Common Stock,$11.705,-0.365,-3.024%,346829193.00,United States,1997,1205690,Industrials,Electrical Products
AEI,Alset Inc. Common Stock (TX),$1.42,-0.01,-0.699%,13113869.00,United States,2020,39050,Finance,Real Estate
AEIS,Advanced Energy Industries Inc. Common Stock,$110.07,0.50,0.456%,4146674485.00,United States,1995,251681,Technology,Industrial Machinery/Components
AEM,Agnico Eagle Mines Limited Common Stock,$85.89,0.09,0.105%,42935233276.00,Canada,,1524914,Basic Materials,Precious Metals
AEMD,Aethlon Medical Inc. Common Stock,$0.399,0.0144,3.744%,5560993.00,United States,,115775,Health Care,Medical/Dental Instruments
AENT,Alliance Entertainment Holding Corporation Class A Common Stock,$4.36,0.71,19.452%,222174133.00,United States,,88094,Consumer Discretionary,Durable Goods
AENTW,Alliance Entertainment Holding Corporation Warrants,$0.175,0.025,16.667%,19417540.00,United States,,126064,Consumer Discretionary,Durable Goods
AEO,American Eagle Outfitters Inc. Common Stock,$19.14,-0.32,-1.644%,3676097036.00,United States,,4416838,Consumer Discretionary,Clothing/Shoe/Accessory Stores
AEON,AEON Biopharma Inc. Class A Common Stock,$0.879,-0.0009,-0.102%,34740047.00,United States,,16968,Health Care,Biotechnology: Pharmaceutical Preparations
AEP,American Electric Power Company Inc. Common Stock,$98.40,1.15,1.183%,52360607508.00,United States,,3879984,Utilities,Electric Utilities: Central
AER,AerCap Holdings N.V. Ordinary Shares,$93.94,-0.37,-0.392%,19022208202.00,Netherlands,2006,1127270,Consumer Discretionary,Diversified Commercial Services
AERT,Aeries Technology Inc. Class A Ordinary Share,$1.65,0.02,1.227%,73425705.00,United States,2021,10802,Consumer Discretionary,Professional Services
AES,The AES Corporation Common Stock,$15.23,0.52,3.535%,10828941865.00,United States,,15466111,Utilities,Electric Utilities: Central
AESI,Atlas Energy Solutions Inc. Common Stock,$19.96,0.80,4.175%,2199928047.00,United States,2023,1205001,Industrials,Mining & Quarrying of Nonmetallic Minerals (No Fuels)
AEVA,Aeva Technologies Inc. Common Stock,$3.85,-0.09,-2.284%,206546463.00,United States,2020,202137,Consumer Discretionary,Auto Parts:O.E.M.
AEYE,AudioEye Inc. Common Stock,$21.71,0.29,1.354%,257895608.00,United States,,138545,Technology,Computer Software: Prepackaged Software
AFB,AllianceBernstein National Municipal Income Fund Inc,$11.28,0.06,0.535%,0.00,United States,2002,88692,Finance,Trusts Except Educational Religious and Charitable
AFBI,Affinity Bancshares Inc. Common Stock (MD),$21.40,0.02,0.094%,137226002.00,United States,2017,2858,Finance,Banks
AFCG,Advanced Flower Capital Inc. Common Stock,$9.71,0.06,0.622%,200677483.00,United States,2021,106385,Finance,Real Estate
AFG,American Financial Group Inc. Common Stock,$126.81,-0.90,-0.705%,10639842780.00,United States,,293475,Finance,Property-Casualty Insurers
AFGB,American Financial Group Inc. 5.875% Subordinated Debentures due 2059,$24.82,0.1687,0.684%,2082492688.00,United States,2019,3750,Finance,Property-Casualty Insurers
AFGC,American Financial Group Inc. 5.125% Subordinated Debentures due 2059,$22.35,-0.05,-0.223%,1875250265.00,United States,2019,4117,Finance,Property-Casualty Insurers
AFGD,American Financial Group Inc. 5.625% Subordinated Debentures due 2060,$24.6709,0.3208,1.317%,2069982629.00,United States,2020,5530,Finance,Property-Casualty Insurers
AFGE,American Financial Group Inc. 4.500% Subordinated Debentures due 2060,$19.93,0.25,1.27%,1672203033.00,United States,2020,2154,Finance,Property-Casualty Insurers
AFJK,Aimei Health Technology Co. Ltd Ordinary Share,$10.58,0.00,0.00%,0.00,United States,2024,1201,,
AFJKR,Aimei Health Technology Co. Ltd Right,$0.2365,0.0246,11.609%,0.00,United States,2024,430,,
AFJKU,Aimei Health Technology Co. Ltd Unit,$10.75,0.00,0.00%,0.00,United States,2023,1,,
AFL,AFLAC Incorporated Common Stock,$104.51,-0.20,-0.191%,58058274861.00,United States,,2578176,Finance,Accident &Health Insurance
AFMD,Affimed N.V.,$3.27,0.01,0.307%,49793804.00,Germany,2014,34559,Health Care,Biotechnology: Pharmaceutical Preparations
AFRI,Forafric Global PLC Ordinary Shares,$10.39,0.08,0.776%,279274909.00,Gibraltar,,12723,Consumer Staples,Packaged Foods
AFRIW,Forafric Global PLC Warrants,$1.17,-0.18,-13.333%,31448666.00,Gibraltar,,101,Consumer Staples,Packaged Foods
AFRM,Affirm Holdings Inc. Class A Common Stock,$43.69,0.47,1.087%,13592689672.00,United States,2021,6609331,Finance,Finance: Consumer Services
AFYA,Afya Limited Class A Common Shares,$17.63,0.46,2.679%,1585807093.00,Brazil,2019,107940,Real Estate,Other Consumer Services
AG,First Majestic Silver Corp. Ordinary Shares (Canada),$7.00,-0.18,-2.507%,2111249392.00,Canada,,7339210,Basic Materials,Precious Metals
AGAE,Allied Gaming & Entertainment Inc. Common Stock,$1.20,0.00,0.00%,45822376.00,United States,2017,103432,Consumer Discretionary,Services-Misc. Amusement & Recreation
AGCO,AGCO Corporation Common Stock,$97.87,-1.52,-1.529%,7305242195.00,United States,,1089461,Industrials,Industrial Machinery/Components
AGD,abrdn Global Dynamic Dividend Fund Common Shares of Beneficial Interest,$10.13,0.06,0.596%,0.00,United States,2006,69515,Finance,Trusts Except Educational Religious and Charitable
AGEN,Agenus Inc. Common Stock,$4.06,0.01,0.247%,87582080.00,United States,2000,395405,Health Care,Biotechnology: Biological Products (No Diagnostic Substances)
AGFY,Agrify Corporation Common Stock,$3.14,0.03,0.965%,5165790.00,United States,2021,10123,Consumer Staples,Farming/Seeds/Milling
AGI,Alamos Gold Inc. Class A Common Shares,$20.11,0.00,0.00%,8440522122.00,Canada,2015,1693647,Basic Materials,Precious Metals
AGIO,Agios Pharmaceuticals Inc. Common Stock,$44.83,-0.04,-0.089%,2556663642.00,United States,2013,658210,Health Care,Biotechnology: Pharmaceutical Preparations
AGL,agilon health inc. Common Stock,$2.67,-0.03,-1.111%,1098659175.00,United States,2021,3491002,Health Care,Misc Health and Biotechnology Services
AGM,Federal Agricultural Mortgage Corporation Common Stock,$182.22,-2.14,-1.161%,1982873214.00,United States,,59506,Finance,Finance Companies
AGM^D,Federal Agricultural Mortgage Corporation 5.700% Non-Cumulative Preferred Stock Series D,$24.36,0.045,0.185%,,United States,,2637,,
AGM^E,Federal Agricultural Mortgage Corporation 5.750% Non-Cumulative Preferred Stock Series E,$23.98,0.0778,0.325%,,United States,,8192,,
AGM^F,Federal Agricultural Mortgage Corporation 5.250% Non-Cumulative Preferred Stock Series F,$22.39,0.02,0.089%,,United States,,8782,,
AGM^G,Federal Agricultural Mortgage Corporation 4.875% Non-Cumulative Preferred Stock Series G,$21.0599,0.0699,0.333%,,United States,,3914,,
AGMH,AGM Group Holdings Inc. Class A Ordinary Shares,$1.84,0.05,2.793%,48492909.00,Hong Kong,2018,121754,Technology,EDP Services
AGNC,AGNC Investment Corp. Common Stock,$9.35,0.04,0.43%,8280732439.00,United States,2008,23229874,Real Estate,Real Estate Investment Trusts
AGNCL,AGNC Investment Corp. Depositary Shares Each Representing a 1/1000th Interest in a Share of 7.75% Series G Fixed-Rate Reset Cumulative Redeemable Preferred Stock,$25.38,0.0371,0.146%,22477538962.00,United States,,2934,Real Estate,Real Estate Investment Trusts
AGNCM,AGNC Investment Corp. Depositary Shares rep 6.875% Series D Fixed-to-Floating Cumulative Redeemable Preferred Stock,$25.02,0.04,0.16%,22158708622.00,United States,,9177,Real Estate,Real Estate Investment Trusts
AGNCN,AGNC Investment Corp. Depositary Shares Each Representing a 1/1000th Interest in a Share of 7.00% Series C Fixed-To-Floating Rate Cumulative Redeemable Preferred Stock,$25.72,-0.04,-0.155%,22778656505.00,United States,,33970,Real Estate,Real Estate Investment Trusts
AGNCO,AGNC Investment Corp. Depositary Shares each representing a 1/1000th interest in a share of 6.50% Series E Fixed-to-Floating Cumulative Redeemable Preferred Stock,$25.38,0.05,0.197%,22477538962.00,United States,,20758,Real Estate,Real Estate Investment Trusts
AGNCP,AGNC Investment Corp. Depositary Shares Each Representing a 1/1000th Interest in a Share of 6.125% Series F Fixed-to-Floating Rate Cumulative Redeemable Preferred Stock,$24.81,0.06,0.242%,21972724257.00,United States,,15782,Real Estate,Real Estate Investment Trusts
