Symbol,Name,Last Sale,Net Change,% Change,Market Cap,Country,IPO Year,Volume,Sector,Industry
IREN,Iris Energy Limited Ordinary Shares,$8.51,-0.54,-5.967%,1611335132.00,Australia,2021,13971217,Technology,EDP Services
IRIX,IRIDEX Corporation Common Stock,$1.42,-0.075,-5.017%,23443365.00,United States,1996,37098,Health Care,Biotechnology: Electromedical & Electrotherapeutic Apparatus
IRM,Iron Mountain Incorporated (Delaware)Common Stock REIT,$122.35,1.19,0.982%,35889638311.00,United States,,1481234,Real Estate,Real Estate Investment Trusts
IRMD,iRadimed Corporation Common Stock,$49.36,1.06,2.195%,625561048.00,United States,2014,38994,Health Care,Medical/Dental Instruments
IROH,Iron Horse Acquisitions Corp. Common Stock,$10.24,0.00,0.00%,0.00,United States,2024,46,,
IROHR,Iron Horse Acquisitions Corp. Right,$0.2598,-0.0402,-13.40%,0.00,United States,2024,1200,,
IRON,Disc Medicine Inc. Common Stock,$58.25,11.12,23.594%,1731525695.00,United States,,2086530,Health Care,Biotechnology: Pharmaceutical Preparations
IROQ,IF Bancorp Inc. Common Stock,$21.1701,-0.2195,-1.026%,70983896.00,United States,2011,7685,Finance,Savings Institutions
IRS,IRSA Inversiones Y Representaciones S.A. Global Depositary Shares (Each representing ten shares of Common Stock),$13.31,0.12,0.91%,986882142.00,Argentina,,158911,Real Estate,Homebuilding
IRT,Independence Realty Trust Inc. Common Stock,$19.25,0.19,0.997%,4333124873.00,United States,2013,1347901,Real Estate,Real Estate Investment Trusts
IRTC,iRhythm Technologies Inc. Common Stock,$81.44,6.40,8.529%,2548911889.00,United States,2016,836887,Health Care,Medical/Dental Instruments
IRWD,Ironwood Pharmaceuticals Inc. Class A Common Stock,$4.19,0.00,0.00%,669306414.00,United States,2010,1146673,Health Care,Biotechnology: Pharmaceutical Preparations
ISD,PGIM High Yield Bond Fund Inc.,$13.80,-0.28,-1.989%,0.00,United States,2012,315545,Finance,Trusts Except Educational Religious and Charitable
ISDR,Issuer Direct Corporation Common Stock,$9.73,0.04,0.413%,37304596.00,United States,,11356,Consumer Discretionary,Publishing
ISPC,iSpecimen Inc. Common Stock,$4.90,0.56,12.903%,3208775.00,United States,2021,986517,Health Care,Biotechnology: Commercial Physical & Biological Resarch
ISPO,Inspirato Incorporated Class A Common Stock,$3.65,-0.02,-0.545%,39475721.00,United States,2021,57780,Finance,Blank Checks
ISPOW,Inspirato Incorporated Warrant,$0.0133,0.00,0.00%,143843.00,United States,2021,3100,Finance,Blank Checks
ISPR,Ispire Technology Inc. Common Stock,$5.80,0.11,1.933%,328518038.00,United States,2023,54763,Health Care, Medicinal Chemicals and Botanical Products 
ISRG,Intuitive Surgical Inc. Common Stock,$507.42,1.08,0.213%,180732573982.00,United States,2000,849671,Health Care,Industrial Specialties
ISRL,Israel Acquisitions Corp Class A Ordinary Shares,$11.24,0.00,0.00%,0.00,United States,2023,53,Finance,Blank Checks
ISRLW,Israel Acquisitions Corp Warrant,$0.032,-0.0016,-4.762%,0.00,United States,2023,21298,Finance,Blank Checks
ISSC,Innovative Solutions and Support Inc. Common Stock,$7.30,0.05,0.69%,127749672.00,United States,2000,62123,Technology,EDP Services
ISTR,Investar Holding Corporation Common Stock,$20.81,0.00,0.00%,204539638.00,United States,2014,29699,Finance,Major Banks
IT,Gartner Inc. Common Stock,$505.06,1.37,0.272%,38919678141.00,United States,1993,463018,Consumer Discretionary,Other Consumer Services
ITCI,Intra-Cellular Therapies Inc. Common Stock,$86.17,-0.37,-0.428%,9135493766.00,United States,,713064,Health Care,Biotechnology: Pharmaceutical Preparations
ITGR,Integer Holdings Corporation Common Stock,$126.53,0.08,0.063%,4244072044.00,United States,,213877,Health Care,Biotechnology: Electromedical & Electrotherapeutic Apparatus
ITIC,Investors Title Company Common Stock,$228.79,-1.95,-0.845%,431012219.00,United States,,15432,Finance,Specialty Insurers
ITOS,iTeos Therapeutics Inc. Common Stock,$8.97,0.16,1.816%,327600950.00,United States,2020,629995,Health Care,Biotechnology: Biological Products (No Diagnostic Substances)
ITP,IT Tech Packaging Inc. Common Stock,$0.24,-0.018,-6.977%,2415821.00,China,,35782,Consumer Discretionary,Containers/Packaging
ITRG,Integra Resources Corp. Common Shares,$1.08,-0.03,-2.703%,95535398.00,,,324971,Basic Materials,Precious Metals
ITRI,Itron Inc. Common Stock,$114.97,3.16,2.826%,5183947863.00,United States,1993,980916,Industrials,Electrical Products
ITRM,Iterum Therapeutics plc Ordinary Share,$1.32,0.10,8.197%,29971912.00,Ireland,2018,1193025,Health Care,Biotechnology: Pharmaceutical Preparations
ITRN,Ituran Location and Control Ltd. Ordinary Shares,$26.53,-0.35,-1.302%,527776677.00,Israel,2005,101876,Technology,Electronic Components
ITT,ITT Inc. Common Stock ,$141.26,0.73,0.519%,11512690000.00,United States,2011,304430,Industrials,Fluid Controls
ITUB,Itau Unibanco Banco Holding SA American Depositary Shares (Each repstg 500 Preferred shares),$6.08,0.14,2.357%,59589269293.00,Brazil,,28199154,Finance,Major Banks
ITW,Illinois Tool Works Inc. Common Stock,$263.88,0.80,0.304%,77923764000.00,United States,,737062,Industrials,Industrial Machinery/Components
IVA,Inventiva S.A. American Depository Shares,$2.76,0.01,0.364%,143839627.00,France,2020,33316,Health Care,Biotechnology: Pharmaceutical Preparations
IVAC,Intevac Inc. Common Stock,$3.355,0.095,2.914%,90368287.00,United States,1995,14176,Technology,Industrial Machinery/Components
IVCA,Investcorp AI Acquisition Corp. Class A Ordinary Share,$11.6641,0.00,0.00%,0.00,Cayman Islands,2022,15,Finance,Blank Checks
IVCAW,Investcorp AI Acquisition Corp. Warrant,$0.0754,0.00,0.00%,0.00,Cayman Islands,2022,10080,Finance,Blank Checks
IVCB,Investcorp Europe Acquisition Corp I Class A Ordinary Shares,$11.488,0.088,0.772%,0.00,Cayman Islands,2022,5286,Finance,Blank Checks
IVCBU,Investcorp Europe Acquisition Corp I Unit,$11.55,0.00,0.00%,0.00,Cayman Islands,2021,9,Finance,Blank Checks
IVCBW,Investcorp Europe Acquisition Corp I Warrant,$0.0125,-0.0049,-28.161%,0.00,Cayman Islands,2022,15692,Finance,Blank Checks
IVCPW,Swiftmerge Acquisition Corp. Warrants,$0.10,0.02,25.00%,0.00,United States,2022,90176,Finance,Blank Checks
IVDA,Iveda Solutions Inc. Common Stock,$1.56,0.0801,5.413%,3523630.00,United States,,253211,Technology,Computer Software: Prepackaged Software
IVDAW,Iveda Solutions Inc. Warrant,$0.0164,-0.0036,-18.00%,37043.00,United States,,6300,Technology,Computer Software: Prepackaged Software
IVP,Inspire Veterinary Partners Inc. Class A Common Stock,$0.244,-0.0109,-4.276%,874495.00,United States,2023,2277531,Consumer Staples,Farming/Seeds/Milling
IVR,INVESCO MORTGAGE CAPITAL INC Common Stock,$8.07,0.01,0.124%,442394858.00,United States,2009,725341,Real Estate,Real Estate Investment Trusts
IVR^B,Invesco Mortgage Capital Inc. Preferred Series B Cum Fxd to Fltg,$24.88,0.19,0.77%,,United States,,1358,,
IVR^C,INVESCO MORTGAGE CAPITAL INC 7.5% Fixed-to-Floating Series C Cumulative Redeemable Preferred Stock Liquation Preference $25.00 per Share,$24.2317,0.2217,0.923%,,United States,,2277,,
IVT,InvenTrust Properties Corp. Common Stock,$29.70,0.16,0.542%,2290773801.00,United States,2021,508798,Real Estate,Real Estate Investment Trusts
IVVD,Invivyd Inc. Common Stock,$0.8993,-0.0143,-1.565%,107414762.00,United States,2021,403206,Health Care,Biotechnology: Biological Products (No Diagnostic Substances)
IVZ,Invesco Ltd Common Stock,$17.47,-0.31,-1.744%,7851715961.00,United States,,2786823,Finance,Investment Managers
IX,Orix Corp Ads Common Stock,$106.82,0.70,0.66%,25956427979.00,Japan,,54806,Finance,Diversified Financial Services
IXHL,Incannex Healthcare Inc. Common Stock,$2.5808,-0.0092,-0.355%,45532621.00,Australia,,66523,Health Care,Biotechnology: Pharmaceutical Preparations
IZEA,IZEA Worldwide Inc. Common Stock,$2.81,0.11,4.074%,46225691.00,United States,,54155,Consumer Discretionary,Advertising
IZM,ICZOOM Group Inc. Class A Ordinary Shares,$2.10,-0.01,-0.474%,24637190.00,China,2023,32198,Consumer Discretionary,Consumer Electronics/Video Chains
J,Jacobs Solutions Inc. Common Stock,$139.84,0.22,0.158%,17374886048.00,United States,2022,642375,Industrials,Military/Government/Technical
JACK,Jack In The Box Inc. Common Stock,$50.10,-0.27,-0.536%,958211648.00,United States,,390893,Consumer Discretionary,Restaurants
JAGX,Jaguar Health Inc. Common Stock,$1.04,-0.02,-1.887%,9610880.00,United States,2015,202048,Health Care,Biotechnology: Pharmaceutical Preparations
JAKK,JAKKS Pacific Inc. Common Stock,$30.50,0.57,1.904%,335013830.00,United States,1996,130812,Consumer Discretionary,Recreational Games/Products/Toys
JAMF,Jamf Holding Corp. Common Stock,$16.87,0.07,0.417%,2153310216.00,United States,2020,277720,Technology,Computer Software: Prepackaged Software
JANX,Janux Therapeutics Inc. Common Stock,$55.87,1.48,2.721%,2914430503.00,United States,2021,838699,Health Care,Biotechnology: Pharmaceutical Preparations
JAZZ,Jazz Pharmaceuticals plc Common Stock (Ireland),$109.41,-1.04,-0.942%,6756451529.00,Ireland,2007,465332,Health Care,Biotechnology: Pharmaceutical Preparations
JBDI,JBDI Holdings Limited Ordinary Shares,$0.9497,0.0004,0.042%,18792189.00,Singapore,2024,118081,,
JBGS,JBG SMITH Properties Common Shares ,$16.90,0.12,0.715%,1427674127.00,United States,2017,295906,Real Estate,Real Estate Investment Trusts
JBHT,J.B. Hunt Transport Services Inc. Common Stock,$181.99,1.03,0.569%,18350043328.00,United States,,742745,Industrials,Trucking Freight/Courier Services
JBI,Janus International Group Inc. Common Stock,$7.04,-0.31,-4.218%,993165740.00,United States,2021,3338304,Industrials,Building Products
JBK,Lehman ABS 3.50 3.50% Adjustable Corp Backed Tr Certs GS Cap I,$26.39,0.28,1.072%,0.00,United States,,100,Finance,Finance: Consumer Services
JBL,Jabil Inc. Common Stock,$127.30,-0.37,-0.29%,14364938596.00,United States,1993,1161311,Technology,Electrical Products
JBLU,JetBlue Airways Corporation Common Stock,$5.71,-0.06,-1.04%,1980665991.00,United States,2002,13939659,Consumer Discretionary,Air Freight/Delivery Services
JBSS,John B. Sanfilippo & Son Inc. Common Stock,$83.16,-2.15,-2.52%,964944066.00,United States,1991,80593,Consumer Staples,Specialty Foods
JBT,John Bean Technologies Corporation Common Stock,$114.92,0.01,0.009%,3659355959.00,United States,,389011,Industrials,Industrial Machinery/Components
JCE,Nuveen Core Equity Alpha Fund Common Shares of Beneficial Interest,$14.99,0.05,0.335%,0.00,United States,2007,20636,Finance,Trusts Except Educational Religious and Charitable
JCI,Johnson Controls International plc Ordinary Share,$74.23,-1.27,-1.682%,49586645742.00,Switzerland,,3412327,Industrials,Industrial Machinery/Components
JCSE,JE Cleantech Holdings Limited Ordinary Shares,$1.40,0.32,29.63%,7009332.00,Singapore,2022,168046,Consumer Discretionary,Miscellaneous manufacturing industries
JCTC,Jewett-Cameron Trading Company Common Shares,$4.25,-0.01,-0.235%,14895409.00,United States,,9791,Consumer Discretionary,RETAIL: Building Materials
JD,JD.com Inc. American Depositary Shares,$39.86,-0.58,-1.434%,62664626828.00,China,2014,7358738,Consumer Discretionary,Other Specialty Stores
JDZG,JIADE LIMITED Common stock,$0.994,-0.206,-17.167%,24090058.00,China,2024,439487,Real Estate,Other Consumer Services
JEF,Jefferies Financial Group Inc. Common Stock,$63.83,-0.39,-0.607%,13116975957.00,United States,,932591,Finance,Investment Bankers/Brokers/Service
JELD,JELD-WEN Holding Inc. Common Stock,$14.13,-0.11,-0.772%,1194587447.00,United States,2017,473627,Basic Materials,Forest Products
JEQ,abrdn Japan Equity Fund Inc. Common Stock,$5.8401,0.0201,0.345%,79425302.00,United States,1992,1597,Consumer Discretionary,Air Freight/Delivery Services
JFBR,Jeffs' Brands Ltd Ordinary Shares,$0.3169,0.0069,2.226%,2909142.00,Israel,2022,1172798,Consumer Discretionary,Other Specialty Stores
JFIN,Jiayin Group Inc. American Depositary Shares,$6.53,0.19,2.997%,346302134.00,China,2019,37044,Finance,Finance: Consumer Services
JFR,Nuveen Floating Rate Income Fund Common Stock,$8.81,-0.03,-0.339%,0.00,United States,2004,475942,Finance,Trusts Except Educational Religious and Charitable
JFU,9F Inc. American Depositary Shares,$1.61,-0.02,-1.227%,18955066.00,China,2019,6820,Finance,Finance: Consumer Services
JG,Aurora Mobile Limited American Depositary Shares,$5.74,0.04,0.702%,34328127.00,China,2018,22605,Technology,Computer Software: Programming Data Processing
JGH,Nuveen Global High Income Fund Common Shares of Beneficial Interest,$12.81,0.05,0.392%,0.00,United States,2014,28084,Finance,Investment Managers
JHG,Janus Henderson Group plc Ordinary Shares,$41.56,-0.09,-0.216%,6607828584.00,United Kingdom,2017,813740,Finance,Investment Managers
JHI,John Hancock Investors Trust Common Stock,$14.0993,-0.0107,-0.076%,123291992.00,United States,,12203,Finance,Trusts Except Educational Religious and Charitable
JHS,John Hancock Income Securities Trust Common Stock,$11.44,-0.01,-0.087%,133236932.00,United States,,5934,Finance,Finance Companies
JHX,James Hardie Industries plc American Depositary Shares (Ireland),$31.74,0.47,1.503%,13768324283.00,Ireland,,88325,Industrials,Building Materials
JILL,J. Jill Inc. Common Stock,$23.96,-0.04,-0.167%,361421170.00,United States,2017,118478,Consumer Discretionary,Apparel
JJSF,J & J Snack Foods Corp. Common Stock,$166.26,0.40,0.241%,3229387853.00,United States,1986,64123,Consumer Staples,Specialty Foods
JKHY,Jack Henry & Associates Inc. Common Stock,$184.32,1.26,0.688%,13438461358.00,United States,1985,644495,Technology,EDP Services
JKS,JinkoSolar Holding Company Limited American Depositary Shares (each representing 4 Common Shares),$27.84,0.47,1.717%,1531218180.00,China,2010,1842718,Technology,Semiconductors
JL,J-Long Group Limited Ordinary Shares,$0.4008,-0.037,-8.451%,12585120.00,Hong Kong,2024,822208,Consumer Discretionary,Clothing/Shoe/Accessory Stores
JLL,Jones Lang LaSalle Incorporated Common Stock,$267.86,2.86,1.079%,12713769987.00,United States,,247498,Finance,Real Estate
JLS,Nuveen Mortgage and Income Fund,$18.16,-0.09,-0.493%,0.00,United States,2009,11538,Finance,Investment Managers
JMIA,Jumia Technologies AG American Depositary Shares each representing two Ordinary Shares,$4.62,0.05,1.094%,565765200.00,,2019,1425577,Consumer Discretionary,Catalog/Specialty Distribution
JMM,Nuveen Multi-Market Income Fund (MA),$6.10,-0.04,-0.651%,0.00,United States,,3413,Finance,Trusts Except Educational Religious and Charitable
JMSB,John Marshall Bancorp Inc. Common Stock,$21.35,-0.10,-0.466%,303834049.00,United States,,7904,Finance,Major Banks
JNJ,Johnson & Johnson Common Stock,$158.24,-1.89,-1.18%,380982259089.00,United States,,4644011,Health Care,Biotechnology: Pharmaceutical Preparations
JNPR,Juniper Networks Inc. Common Stock,$38.98,-0.02,-0.051%,12905851442.00,United States,1999,3284189,Telecommunications,Computer Communications Equipment
JNVR,Janover Inc. Common Stock,$0.5416,0.0318,6.238%,6056292.00,United States,2023,796045,Finance,Finance: Consumer Services
JOB,GEE Group Inc. Common Stock,$0.2588,0.0088,3.52%,28150084.00,United States,1968,400910,Consumer Discretionary,Diversified Commercial Services
JOBY,Joby Aviation Inc. Common Stock,$5.04,0.17,3.491%,3609359092.00,United States,2020,13784957,Industrials,Aerospace
JOE,St. Joe Company (The) Common Stock,$51.37,0.69,1.361%,2999879883.00,United States,,190882,Real Estate,Homebuilding
JOF,Japan Smaller Capitalization Fund Inc Common Stock,$7.62,0.01,0.131%,0.00,United States,1990,39595,Finance,Trusts Except Educational Religious and Charitable
JOUT,Johnson Outdoors Inc. Class A Common Stock,$32.22,0.14,0.436%,332007510.00,United States,,51848,Consumer Discretionary,Recreational Games/Products/Toys
JPC,Nuveen Preferred & Income Opportunities Fund,$8.01,-0.07,-0.866%,0.00,United States,2003,649125,Finance,Investment Managers
JPI,Nuveen Preferred Securities & Income Opportunities Fund Common Shares,$21.18,0.18,0.857%,482319834.00,,2012,13367,Finance,Finance Companies
JPM,JP Morgan Chase & Co. Common Stock,$219.78,-3.16,-1.417%,618755517947.00,United States,,8229588,Finance,Major Banks
JPM^C,J P Morgan Chase & Co Depositary Shares each representing a 1/400th interest in a share of 6.00% Non-Cumulative  Preferred Stock Series EE,$25.28,0.05,0.198%,,United States,,109689,,
JPM^D,J P Morgan Chase & Co Depositary Shares each representing a 1/400th  interest in a share of 5.75% Non-Cumulative  Preferred Stock Series DD,$25.04,0.15,0.603%,,United States,,82817,,
JPM^J,J P Morgan Chase & Co Depositary Shares each representing a 1/400th interest in a share of JPMorgan Chase & Co. 4.75% Non-Cumulative Preferred Stock Series GG,$22.69,0.27,1.204%,,United States,,46893,,
JPM^K,J P Morgan Chase & Co Depositary Shares each representing a 1/400th interest in a share of 4.55% Non-Cumulative Preferred Stock Series JJ,$21.33,0.28,1.33%,,United States,,72888,,
JPM^L,J P Morgan Chase & Co Depositary Shares each representing a 1/400th interest in a share of 4.625% Non-Cumulative Preferred Stock Series LL,$21.92,0.34,1.576%,,United States,,369840,,
JPM^M,J P Morgan Chase & Co Depositary Shares each representing a 1/400th interest in a share of 4.20% Non-Cumulative Preferred Stock Series MM,$20.01,0.31,1.574%,,United States,,169182,,
JQC,Nuveen Credit Strategies Income Fund Shares of Beneficial Interest,$5.67,-0.06,-1.047%,0.00,United States,2003,423869,Finance,Finance Companies
JRI,Nuveen Real Asset Income and Growth Fund Common Shares of Beneficial Interest,$13.10,0.05,0.383%,0.00,United States,2012,95980,Finance,Finance Companies
JRS,Nuveen Real Estate Income Fund Common Shares of Beneficial Interest,$8.84,0.13,1.493%,0.00,United States,2001,175325,Finance,Finance/Investors Services
JRSH,Jerash Holdings (US) Inc. Common Stock,$2.9971,-0.0429,-1.411%,36848865.00,United States,2018,12481,Consumer Discretionary,Apparel
JRVR,James River Group Holdings Ltd. Common Shares,$6.06,-0.17,-2.729%,229224148.00,Bermuda,2014,204121,Finance,Property-Casualty Insurers
JSM,Navient Corporation 6% Senior Notes due December 15 2043,$19.96,0.18,0.91%,2142975061.00,United States,,8383,Finance,Finance: Consumer Services
JSPR,Jasper Therapeutics Inc. Common Stock,$22.03,0.76,3.573%,332769759.00,United States,2020,221336,Health Care,Biotechnology: Biological Products (No Diagnostic Substances)
JSPRW,Japer Therapeutics Inc. Warrants,$0.23,0.0001,0.043%,3474219.00,United States,2020,3010,Health Care,Biotechnology: Biological Products (No Diagnostic Substances)
JTAI,Jet.AI Inc. Common Stock,$0.0686,0.0067,10.824%,1685974.00,United States,2021,26966904,Consumer Discretionary,Transportation Services
JUNE,Junee Limited Ordinary Shares,$5.07,0.27,5.625%,64461430.00,Hong Kong,2024,75290,,
JVA,Coffee Holding Co. Inc. Common Stock,$2.93,-0.06,-2.007%,16726195.00,United States,2005,43333,Consumer Staples,Packaged Foods
JVSA,JV SPAC Acquisition Corp. Class A Ordinary Share,$10.37,0.00,0.00%,0.00,China,2024,61,,
JVSAU,JVSPAC Acquisition Corp. Unit,$10.76,0.01,0.093%,0.00,China,2024,311,,
JWEL,Jowell Global Ltd. Ordinary Shares,$1.7491,0.0091,0.523%,3796378.00,China,2021,6323,Consumer Discretionary,Other Consumer Services
JWN,Nordstrom Inc. Common Stock,$22.91,0.35,1.551%,3762073758.00,United States,,1348875,Consumer Discretionary,Clothing/Shoe/Accessory Stores
JXJT,JX Luxventure Limited Common Stock,$1.34,-0.04,-2.899%,8124677.00,China,2013,31354,Consumer Staples,Apparel
JXN,Jackson Financial Inc. Class A Common Stock ,$98.20,-0.12,-0.122%,7388667771.00,United States,2021,612117,Finance,Life Insurance
JXN^A,Jackson Financial Inc. Depositary Shares each representing a 1/1000th interest in a share of Fixed-Rate Reset Noncumulative Perpetual Preferred Stock Series A,$27.24,0.15,0.554%,,United States,,55974,,
JYD,Jayud Global Logistics Limited Class A Ordinary Shares,$0.83,-0.02,-2.353%,17722345.00,China,2023,3620,Consumer Discretionary,Oil Refining/Marketing
JYNT,The Joint Corp. Common Stock,$11.10,0.02,0.181%,166464203.00,United States,2014,19621,Miscellaneous,Multi-Sector Companies
JZ,Jianzhi Education Technology Group Company Limited American Depositary Shs,$0.8906,-0.0594,-6.253%,17976761.00,China,2022,12922,Real Estate,Other Consumer Services
JZXN,Jiuzi Holdings Inc. Ordinary Shares,$1.4783,0.0233,1.601%,13384525.00,China,2021,7374,Consumer Discretionary,Retail-Auto Dealers and Gas Stations
K,Kellanova Common Stock,$80.60,-0.01,-0.012%,27782650256.00,United States,,1858077,Consumer Staples,Packaged Foods
KACL,Kairous Acquisition Corp. Limited Ordinary Shares,$12.30,0.00,0.00%,0.00,Malaysia,2022,111,Finance,Blank Checks
KACLR,Kairous Acquisition Corp. Limited Rights,$0.11,0.00,0.00%,0.00,Malaysia,2022,213,Finance,Blank Checks
KACLW,Kairous Acquisition Corp. Limited Warrants,$0.0107,0.0001,0.943%,0.00,Malaysia,2022,582,Finance,Blank Checks
KAI,Kadant Inc Common Stock,$349.69,6.31,1.838%,4106956585.00,United States,1992,45914,Industrials,Industrial Machinery/Components
KALA,KALA BIO Inc. Common Stock,$6.78,-0.21,-3.004%,31239318.00,United States,2017,18943,Health Care,Biotechnology: Pharmaceutical Preparations
KALU,Kaiser Aluminum Corporation Common Stock,$77.37,1.77,2.341%,1244728947.00,United States,,152558,Industrials,Metal Fabrications
KALV,KalVista Pharmaceuticals Inc. Common Stock,$11.63,1.02,9.614%,502595939.00,United Kingdom,2015,755375,Health Care,Biotechnology: Pharmaceutical Preparations
KAPA,Kairos Pharma Ltd. Common Stock,$1.35,0.01,0.746%,17336615.00,,2024,18279,Health Care,Biotechnology: Pharmaceutical Preparations
KAR,OPENLANE Inc. Common Stock,$16.20,0.30,1.887%,1759633405.00,United States,2009,409030,Consumer Discretionary,Retail-Auto Dealers and Gas Stations
KARO,Karooooo Ltd. Ordinary Shares,$40.35,2.06,5.38%,1246815000.00,Singapore,2021,18388,Technology,Computer Software: Prepackaged Software
KAVL,Kaival Brands Innovations Group Inc. Common Stock,$1.01,-0.01,-0.98%,6851798.00,United States,,157881,Consumer Discretionary,Other Consumer Services
KB,KB Financial Group Inc,$65.24,-0.84,-1.271%,24704027943.00,South Korea,,95723,Finance,Commercial Banks
KBDC,Kayne Anderson BDC Inc. Common Stock,$16.12,-0.17,-1.044%,0.00,,2024,12636,,
KBH,KB Home Common Stock,$79.70,1.74,2.232%,5844757817.00,United States,1986,780585,Consumer Discretionary,Homebuilding
KBR,KBR Inc. Common Stock,$67.38,0.09,0.134%,8977845960.00,United States,2006,780873,Industrials,Military/Government/Technical
KC,Kingsoft Cloud Holdings Limited American Depositary Shares,$2.77,-0.04,-1.423%,702709259.00,China,2020,2512531,Technology,Computer Software: Prepackaged Software
KD,Kyndryl Holdings Inc. Common Stock,$23.00,0.03,0.131%,5317772132.00,United States,2021,1970316,Technology,EDP Services
KDLY,Kindly MD Inc. Common Stock,$0.93,-0.0399,-4.114%,5530867.00,United States,2024,73335,Health Care,Medical/Nursing Services
KDLYW,Kindly MD Inc. Warrants,$0.17,0.00,0.00%,1011019.00,United States,2024,3,Health Care,Medical/Nursing Services
KDP,Keurig Dr Pepper Inc. Common Stock,$32.68,-0.14,-0.427%,44328905249.00,United States,,11360251,Consumer Staples,Beverages (Production/Distribution)
KE,Kimball Electronics Inc. Common Stock,$18.47,0.32,1.763%,456825122.00,United States,,137931,Technology,Electrical Products
KELYA,Kelly Services Inc. Class A Common Stock,$20.26,0.19,0.947%,720614690.00,United States,,104766,Consumer Discretionary,Professional Services
KELYB,Kelly Services Inc. Class B Common Stock,$19.82,0.00,0.00%,704964618.00,United States,,29,Consumer Discretionary,Professional Services
KEN,Kenon Holdings Ltd. Ordinary Shares,$28.11,-0.4203,-1.473%,1483247903.00,Singapore,2015,9645,Utilities,Electric Utilities: Central
KEP,Korea Electric Power Corporation Common Stock,$8.31,0.02,0.241%,10669442960.00,South Korea,1994,86763,Utilities,Electric Utilities: Central
KEQU,Kewaunee Scientific Corporation Common Stock,$34.90,-1.88,-5.111%,100226099.00,United States,,14640,Industrials,Medical Specialities
KEX,Kirby Corporation Common Stock,$115.33,1.05,0.919%,6677607000.00,United States,,471064,Consumer Discretionary,Marine Transportation
KEY,KeyCorp Common Stock,$17.04,-0.15,-0.873%,16072055290.00,United States,,8129962,Finance,Major Banks
KEY^I,KeyCorp Depositary Shares Each Representing a 1/40th Ownership Interest in a Share of Fixed-to-Floating Rate Perpetual Non-Cumulative Preferred Stock Series E,$25.43,0.11,0.434%,,United States,,25418,,
KEY^J,KeyCorp Depositary Shares each representing a 1/40th ownership interest in a share of Fixed Rate Perpetual Non-Cumulative Preferred Stock Series F,$23.52,0.28,1.205%,,United States,,22168,,
KEY^K,KeyCorp Depositary Shares each representing a 1/40th ownership interest in a share of Fixed Rate Perpetual Non-Cumulative Preferred Stock Series G,$23.87,0.37,1.574%,,United States,,142758,,
KEY^L,KeyCorp Depositary Shares each representing a 1/40th ownership interest in a share of Fixed Rate Perpetual Non-Cumulative Preferred Stock Series H,$25.16,0.16,0.64%,,United States,,39567,,
KEYS,Keysight Technologies Inc. Common Stock,$153.56,2.01,1.326%,26649317594.00,United States,2014,1127427,Industrials,Industrial Machinery/Components
KF,Korea Fund Inc. (The) New Common Stock,$21.8044,0.2544,1.181%,0.00,United States,,3137,Finance,Investment Managers
KFFB,Kentucky First Federal Bancorp Common Stock,$2.67,0.005,0.188%,21591529.00,United States,2005,10366,Finance,Savings Institutions
KFRC,Kforce Inc. Common Stock,$57.84,1.99,3.563%,1103587200.00,United States,1995,175890,Consumer Discretionary,Professional Services
KFS,Kingsway Financial Services Inc. Common Stock (DE),$9.40,0.57,6.455%,261422676.00,Canada,,23940,Finance,Property-Casualty Insurers
KFY,Korn Ferry Common Stock,$71.74,1.09,1.543%,3731243601.00,United States,1999,187721,Consumer Discretionary,Diversified Commercial Services
KGC,Kinross Gold Corporation Common Stock,$9.97,-0.01,-0.10%,12253130000.00,Canada,2001,12798042,Basic Materials,Precious Metals
KGEI,Kolibri Global Energy Inc. Common stock,$3.395,0.04,1.192%,121323601.00,United States,,10228,Energy,Oil & Gas Production
