Symbol,Name,Last Sale,Net Change,% Change,Market Cap,Country,IPO Year,Volume,Sector,Industry
CTO^A,CTO Realty Growth Inc. 6.375% Series A Cumulative Redeemable Preferred Stock,$24.17,-0.125,-0.515%,,United States,,3943,,
CTOR,Citius Oncology Inc. Common Stock,$1.03,-0.11,-9.649%,2425906.00,United States,2022,70709,Health Care,Biotechnology: Pharmaceutical Preparations
CTOS,Custom Truck One Source Inc. Common Stock,$4.11,0.08,1.985%,959407439.00,Cayman Islands,2017,486053,Consumer Discretionary,Diversified Commercial Services
CTRA,Coterra Energy Inc. Common Stock,$23.07,0.36,1.585%,16993662371.00,United States,,9161205,Energy,Oil & Gas Production
CTRE,CareTrust REIT Inc. Common Stock,$31.06,-1.31,-4.047%,5325243026.00,United States,2022,6888843,Real Estate,Real Estate Investment Trusts
CTRI,Centuri Holdings Inc. Common Stock,$18.95,-0.05,-0.263%,1677407023.00,,2024,502015,Utilities,Oil & Gas Production
CTRM,Castor Maritime Inc. Common Shares,$3.78,-0.11,-2.828%,36523823.00,Cyprus,,60804,Consumer Discretionary,Marine Transportation
CTRN,Citi Trends Inc. Common Stock,$19.05,0.20,1.061%,164122284.00,United States,2005,48785,Consumer Discretionary,Clothing/Shoe/Accessory Stores
CTS,CTS Corporation Common Stock,$51.52,0.35,0.684%,1551552878.00,United States,,139354,Technology,Electrical Products
CTSH,Cognizant Technology Solutions Corporation Class A Common Stock,$74.90,0.29,0.389%,37137237074.00,United States,1998,4665059,Technology,EDP Services
CTSO,Cytosorbents Corporation Common Stock,$0.8705,-0.1295,-12.95%,47273734.00,United States,,164612,Health Care,Medical/Dental Instruments
CTV,Innovid Corp. Common Stock,$1.93,0.00,0.00%,282566371.00,,2021,140196,Technology,Computer Software: Prepackaged Software
CTVA,Corteva Inc. Common Stock ,$61.21,0.35,0.575%,42372438870.00,United States,2019,2578372,Consumer Staples,Farming/Seeds/Milling
CTXR,Citius Pharmaceuticals Inc. Common Stock,$0.349,-0.0099,-2.758%,63073167.00,United States,,536306,Health Care,Biotechnology: Pharmaceutical Preparations
CUB,Lionheart Holdings Class A Ordinary Shares,$10.02,0.00,0.00%,318321132.00,United States,2024,2,Industrials,Industrial Machinery/Components
CUBA,Herzfeld Caribbean Basin Fund Inc. (The) Common Stock,$2.412,-0.028,-1.148%,0.00,United States,,17960,Finance,Investment Managers
CUBB,Customers Bancorp Inc 5.375% Subordinated Notes Due 2034,$20.641,-0.254,-1.216%,654270946.00,United States,2019,540,Finance,Major Banks
CUBE,CubeSmart Common Shares,$48.00,0.67,1.416%,10855357920.00,United States,,1569869,Real Estate,Real Estate Investment Trusts
CUBI,Customers Bancorp Inc Common Stock,$45.66,-0.02,-0.044%,1447314151.00,United States,,468335,Finance,Major Banks
CUBI^E,Customers Bancorp Inc Fixed-to-Floating Rate Non-Cumulative Perpetual Preferred Stock Series E,$25.75,-0.05,-0.194%,,United States,,2640,,
CUBI^F,Customers Bancorp Inc Fixed-to-Floating Rate Non-Cumulative Perpetual Preferred Stock Series F,$25.2501,-0.0499,-0.197%,,United States,,8021,,
CUBWU,Lionheart Holdings Unit,$10.04,0.00,0.00%,0.00,United States,2024,1,Finance,Blank Checks
CUBWW,Lionheart Holdings Warrant,$0.085,0.0113,15.332%,0.00,United States,2024,520,,
CUE,Cue Biopharma Inc. Common Stock,$1.49,-0.03,-1.974%,72478541.00,United States,2018,430274,Health Care,Biotechnology: Pharmaceutical Preparations
CUK,Carnival Plc ADS ADS,$19.96,0.05,0.251%,26783269334.00,United States,,983209,Consumer Discretionary,Marine Transportation
CULP,Culp Inc. Common Stock,$5.29,0.01,0.189%,66073581.00,United States,,3021,Consumer Discretionary,Textiles
CURB,Curbline Properties Corp. Common Stock,$22.94,0.44,1.956%,2405493493.00,United States,2024,589043,Finance,Real Estate
CURI,CuriosityStream Inc. Class A Common Stock,$2.39,0.00,0.00%,130494755.00,United States,2020,108326,Consumer Discretionary,Movies/Entertainment
CURIW,CuriosityStream Inc. Warrant,$0.0301,-0.0044,-12.754%,1643470.00,United States,2020,507,Consumer Discretionary,Movies/Entertainment
CURR,Currenc Group Inc. Ordinary Shares,$1.98,-0.19,-8.756%,20940777.00,Singapore,,13005,Consumer Discretionary,Business Services
CURV,Torrid Holdings Inc. Common Stock,$3.57,-0.03,-0.833%,373708421.00,,2021,581315,Consumer Discretionary,Clothing/Shoe/Accessory Stores
CUTR,Cutera Inc. Common Stock,$0.558,-0.0285,-4.859%,11231336.00,United States,2004,339676,Health Care,Biotechnology: Electromedical & Electrotherapeutic Apparatus
CUZ,Cousins Properties Incorporated Common Stock,$30.82,0.84,2.802%,4688960594.00,United States,,1831998,Real Estate,Real Estate Investment Trusts
CVAC,CureVac N.V. Ordinary Shares,$2.71,-0.05,-1.812%,607009309.00,Germany,2020,880544,Health Care,Biotechnology: Pharmaceutical Preparations
CVBF,CVB Financial Corporation Common Stock,$18.96,-0.31,-1.609%,2648387310.00,United States,,528697,Finance,Major Banks
CVCO,Cavco Industries Inc. Common Stock When Issued,$444.21,-2.51,-0.562%,3601064769.00,United States,,49164,Consumer Discretionary,Homebuilding
CVE,Cenovus Energy Inc Common Stock,$16.21,0.54,3.446%,30087413420.00,Canada,,9120097,Energy,Oil & Gas Production
CVEO,Civeo Corporation (Canada) Common Shares,$24.69,-0.82,-3.214%,340050481.00,,2014,137410,Consumer Discretionary,Hotels/Resorts
CVGI,Commercial Vehicle Group Inc. Common Stock,$3.08,0.07,2.326%,106265455.00,United States,2004,293144,Consumer Discretionary,Auto Parts:O.E.M.
CVGW,Calavo Growers Inc. Common Stock,$27.26,0.23,0.851%,485270907.00,United States,,98881,Consumer Discretionary,Specialty Foods
CVI,CVR Energy Inc. Common Stock,$16.44,0.47,2.943%,1652723048.00,United States,2007,2204739,Energy,Integrated oil Companies
CVKD,Cadrenal Therapeutics Inc. Common Stock,$14.28,-3.32,-18.864%,15240059.00,United States,2023,152184,Health Care,Biotechnology: Pharmaceutical Preparations
CVLG,Covenant Logistics Group Inc. Class A Common Stock,$51.10,-0.20,-0.39%,673480984.00,United States,,49769,Industrials,Trucking Freight/Courier Services
CVLT,Commvault Systems Inc. Common Stock,$157.29,1.60,1.028%,6877656248.00,United States,2006,470210,Technology,Computer Software: Prepackaged Software
CVM,Cel-Sci Corporation Common Stock,$0.8275,-0.0455,-5.212%,50885647.00,United States,1997,474459,Health Care,Biotechnology: Biological Products (No Diagnostic Substances)
CVNA,Carvana Co. Class A Common Stock,$226.08,-3.00,-1.31%,46940938854.00,United States,2017,3892650,Consumer Discretionary,Retail-Auto Dealers and Gas Stations
CVR,Chicago Rivet & Machine Co. Common Stock,$19.115,-0.11,-0.572%,18467613.00,United States,1930,371,Industrials,Industrial Machinery/Components
CVRX,CVRx Inc. Common Stock,$15.05,1.65,12.313%,365168128.00,United States,2021,1247757,Health Care,Medical/Dental Instruments
CVS,CVS Health Corporation Common Stock,$54.65,-1.16,-2.078%,68748567106.00,United States,,11544198,Consumer Staples,Retail-Drug Stores and Proprietary Stores
CVU,CPI Aerostructures Inc. Common Stock,$3.37,0.08,2.432%,43933416.00,United States,2022,26477,Industrials,Military/Government/Technical
CVV,CVD Equipment Corporation Common Stock,$2.91,-0.04,-1.356%,20026149.00,United States,,14924,Technology,Industrial Machinery/Components
CVX,Chevron Corporation Common Stock,$153.97,0.90,0.588%,281598367889.00,United States,,6129961,Energy,Integrated oil Companies
CW,Curtiss-Wright Corporation Common Stock,$350.01,1.19,0.341%,13282243532.00,United States,,247956,Technology,Industrial Machinery/Components
CWAN,Clearwater Analytics Holdings Inc. Class A Common Stock,$26.31,0.02,0.076%,6480776389.00,United States,2021,1417671,Technology,Computer Software: Prepackaged Software
CWBC,Community West Bancshares Common Stock,$18.53,-0.08,-0.43%,350968540.00,United States,,25060,Finance,Major Banks
CWCO,Consolidated Water Co. Ltd. Ordinary Shares,$23.89,0.24,1.015%,378285226.00,Cayman Islands,,74053,Utilities,Water Supply
CWD,CaliberCos Inc. Class A Common Stock,$0.69,0.029,4.387%,15211086.00,United States,2023,54077,Finance,Real Estate
CWEN,Clearway Energy Inc. Class C Common Stock,$28.20,0.59,2.137%,3327600000.00,United States,2015,1062462,Utilities,Electric Utilities: Central
CWH,Camping World Holdings Inc. Class A Common Stock,$20.58,0.37,1.831%,1857512213.00,United States,2016,5480999,Consumer Discretionary,Retail-Auto Dealers and Gas Stations
CWK,Cushman & Wakefield plc Ordinary Shares,$13.14,0.11,0.844%,3012342451.00,,2018,1814144,Finance,Real Estate
CWST,Casella Waste Systems Inc. Class A Common Stock,$99.45,0.11,0.111%,6296542691.00,United States,1997,345469,Utilities,Environmental Services
CWT,California Water Service Group Common Stock,$49.73,-0.41,-0.818%,2957606662.00,United States,,350027,Utilities,Water Supply
CX,Cemex S.A.B. de C.V. Sponsored ADR,$5.17,-0.01,-0.193%,7491779914.00,Mexico,,8867064,Industrials,Building Materials
CXAI,CXApp Inc. Class A Common Stock,$1.35,-0.05,-3.571%,20610395.00,United States,2021,371405,Technology,EDP Services
CXAIW,CXApp Inc. Warrant,$0.2062,-0.0149,-6.739%,3148047.00,United States,2021,18069,Technology,EDP Services
CXDO,Crexendo Inc. Common Stock,$5.73,0.06,1.058%,153076417.00,United States,,105408,Telecommunications,Telecommunications Equipment
CXE,MFS High Income Municipal Trust Common Stock,$3.82,0.01,0.262%,120428453.00,United States,1989,40092,Finance,Investment Managers
CXH,MFS Investment Grade Municipal Trust Common Stock,$8.1499,0.0699,0.865%,74247586.00,United States,1989,14006,Finance,Investment Managers
CXM,Sprinklr Inc. Class A Common Stock,$7.60,0.06,0.796%,1926360456.00,United States,2021,2925012,Technology,Computer Software: Prepackaged Software
CXT,Crane NXT Co. Common Stock,$53.35,-0.63,-1.167%,3048259217.00,United States,,298150,Industrials,Metal Fabrications
CXW,CoreCivic Inc. Common Stock,$13.19,-0.12,-0.902%,1454468053.00,United States,,2388987,Real Estate,Real Estate Investment Trusts
CYBN,Cybin Inc. Common Shares,$10.12,0.13,1.301%,202318109.00,Canada,,60503,Health Care,Biotechnology: Pharmaceutical Preparations
CYBR,CyberArk Software Ltd. Ordinary Shares,$274.10,-2.06,-0.746%,11582187598.00,Israel,2014,506463,Technology,Computer Software: Prepackaged Software
CYCC,Cyclacel Pharmaceuticals Inc. Common Stock,$0.505,-0.1219,-19.445%,996973.00,United States,,661329,Health Care,Biotechnology: Pharmaceutical Preparations
CYCCP,Cyclacel Pharmaceuticals Inc. 6% Convertible Preferred Stock,$7.50,0.00,0.00%,14806530.00,United States,,2,Health Care,Biotechnology: Pharmaceutical Preparations
CYCN,Cyclerion Therapeutics Inc. Common Stock,$2.6363,-0.3137,-10.634%,7144626.00,United States,,96665,Health Care,Biotechnology: Pharmaceutical Preparations
CYD,China Yuchai International Limited Common Stock,$10.98,-0.37,-3.26%,448624024.00,Singapore,1994,17388,Industrials,Industrial Machinery/Components
CYH,Community Health Systems Inc. Common Stock,$4.38,0.18,4.286%,608592494.00,United States,2000,1381338,Health Care,Hospital/Nursing Management
CYN,Cyngn Inc. Common Stock,$3.67,0.17,4.857%,7437376.00,United States,2021,32238,Technology,EDP Services
CYRX,CryoPort Inc. Common Stock,$7.67,0.52,7.273%,378992295.00,United States,,405347,Health Care,Biotechnology: Pharmaceutical Preparations
CYTH,Cyclo Therapeutics Inc. Common Stock,$0.73,0.0084,1.164%,20948100.00,United States,,14256,Health Care,Biotechnology: Biological Products (No Diagnostic Substances)
CYTHW,Cyclo Therapeutics Inc. Warrant,$0.2499,0.00,0.00%,7171137.00,United States,,1200,Health Care,Biotechnology: Biological Products (No Diagnostic Substances)
CYTK,Cytokinetics Incorporated Common Stock,$51.48,-0.34,-0.656%,6057115075.00,United States,2004,718726,Health Care,Biotechnology: Pharmaceutical Preparations
CYTO,Altamira Therapeutics Ltd. Common Shares,$0.518,0.018,3.60%,1673140.00,Bermuda,2014,35408,Health Care,Biotechnology: Pharmaceutical Preparations
CZFS,Citizens Financial Services Inc. Common Stock,$59.24,2.38,4.186%,281978312.00,United States,,18556,Finance,Major Banks
CZNC,Citizens & Northern Corp Common Stock,$18.86,0.11,0.587%,290301494.00,United States,,11675,Finance,Major Banks
CZR,Caesars Entertainment Inc. Common Stock,$39.65,0.43,1.096%,8424846671.00,United States,,3035667,Consumer Discretionary,Hotels/Resorts
CZWI,Citizens Community Bancorp Inc. Common Stock,$14.05,0.02,0.143%,144677641.00,United States,2006,42528,Finance,Savings Institutions
D,Dominion Energy Inc. Common Stock,$57.62,-1.37,-2.322%,48401354650.00,United States,,6337703,Utilities,Electric Utilities: Central
DAC,Danaos Corporation Common Stock,$81.75,-0.20,-0.244%,1587478398.00,Greece,2006,73690,Consumer Discretionary,Marine Transportation
DADA,Dada Nexus Limited American Depositary Shares,$1.64,-0.03,-1.796%,433087659.00,China,2020,868481,Technology,Computer Software: Programming Data Processing
DAIO,Data I/O Corporation Common Stock,$2.59,-0.09,-3.358%,23920378.00,United States,1981,113119,Industrials,Electrical Products
DAKT,Daktronics Inc. Common Stock,$13.12,0.13,1.001%,612033083.00,United States,1994,216001,Consumer Discretionary,Miscellaneous manufacturing industries
DAL,Delta Air Lines Inc. Common Stock,$56.89,-1.50,-2.569%,36710048663.00,United States,,7959832,Consumer Discretionary,Air Freight/Delivery Services
DALN,DallasNews Corporation Series A Common Stock,$5.10,-0.16,-3.042%,27297699.00,United States,,7739,Consumer Discretionary,Newspapers/Magazines
DAN,Dana Incorporated Common Stock ,$7.72,-0.19,-2.402%,1119238860.00,United States,,1893777,Consumer Discretionary,Auto Parts:O.E.M.
DAO,Youdao Inc. American Depositary Shares each representing one Class A Ordinary Share,$4.94,-0.29,-5.545%,597345541.00,China,2019,82101,Real Estate,Other Consumer Services
DAR,Darling Ingredients Inc. Common Stock,$39.80,0.40,1.015%,6329153051.00,United States,1997,1681155,Consumer Staples,Packaged Foods
DARE,Dare Bioscience Inc. Common Stock,$3.89,-0.27,-6.49%,33245344.00,United States,2014,14625,Health Care,Biotechnology: Pharmaceutical Preparations
DASH,DoorDash Inc. Class A Common Stock,$157.24,1.58,1.015%,65316904620.00,United States,,2328099,Consumer Discretionary,Business Services
DATS,DatChat Inc. Common Stock,$1.83,0.24,15.094%,5507072.00,United States,2021,670423,Telecommunications,Telecommunications Equipment
DATSW,DatChat Inc. Series A Warrant,$0.06,0.00,0.00%,180560.00,United States,2021,40,Telecommunications,Telecommunications Equipment
DAVA,Endava plc American Depositary Shares (each representing one Class A Ordinary Share),$23.97,0.26,1.097%,1414983425.00,United Kingdom,2018,535251,Technology,EDP Services
DAVE,Dave Inc. Class A Common Stock,$37.67,-0.54,-1.413%,477250271.00,United States,,292052,Finance,Finance: Consumer Services
DAVEW,Dave Inc. Warrants,$0.0313,-0.0044,-12.325%,396547.00,United States,,10066,Finance,Finance: Consumer Services
DAWN,Day One Biopharmaceuticals Inc. Common Stock,$14.81,0.16,1.092%,1493533614.00,United States,2021,1355273,Health Care,Biotechnology: Pharmaceutical Preparations
DAY,Dayforce Inc. Common Stock,$75.40,0.17,0.226%,11890580000.00,United States,2018,2910770,Technology,Computer Software: Prepackaged Software
DB,Deutsche Bank AG Common Stock,$17.12,0.07,0.411%,34924800000.00,Germany,,1967221,Finance,Major Banks
DBD,Diebold Nixdorf Incorporated Common stock,$46.93,0.39,0.838%,1763003729.00,United States,2023,135159,Miscellaneous,Office Equipment/Supplies/Services
DBGI,Digital Brands Group Inc. Common Stock,$0.0974,-0.0037,-3.66%,254898.00,United States,2021,6445375,Consumer Discretionary,Clothing/Shoe/Accessory Stores
DBGIW,Digital Brands Group Inc. Warrant,$13.50,0.55,4.247%,35329865.00,United States,2021,2441,Consumer Discretionary,Clothing/Shoe/Accessory Stores
DBI,Designer Brands Inc. Class A Common Stock,$5.12,0.04,0.787%,284157343.00,United States,,1434232,Consumer Discretionary,Clothing/Shoe/Accessory Stores
DBL,DoubleLine Opportunistic Credit Fund Common Shares of Beneficial Interest,$15.36,0.07,0.458%,0.00,United States,2012,42856,,
DBRG,DigitalBridge Group Inc.,$12.57,-0.84,-6.264%,2189545900.00,United States,2014,4577306,Real Estate,Real Estate Investment Trusts
DBRG^H,DigitalBridge Group Inc. 7.125% Series H ,$25.01,0.00,0.00%,,United States,,3704,,
DBRG^I,DigitalBridge Group Inc. 7.15% Series I ,$25.02,0.12,0.482%,,United States,,4947,,
DBRG^J,DigitalBridge Group Inc. 7.125% Series J ,$24.82,0.16,0.649%,,United States,,15753,,
DBVT,DBV Technologies S.A. American Depositary Shares,$0.78,0.0188,2.47%,75269163.00,France,2014,109821,Health Care,Biotechnology: Biological Products (No Diagnostic Substances)
DBX,Dropbox Inc. Class A Common Stock,$26.23,0.25,0.962%,8535703648.00,United States,2018,2179972,Technology,Computer Software: Prepackaged Software
DC,Dakota Gold Corp. Common Stock,$2.26,-0.01,-0.441%,211677175.00,United States,2022,185954,Basic Materials,Metal Mining
DCBO,Docebo Inc. Common Shares,$48.04,-0.35,-0.723%,1452293733.00,Canada,,51127,Technology,Computer Software: Prepackaged Software
DCF,BNY Mellon Alcentra Global Credit Income 2024 Target Term Fund Inc. Common Stock,$9.22,0.01,0.109%,0.00,,2017,35634,Finance,Finance/Investors Services
DCGO,DocGo Inc. Common Stock,$3.38,-0.25,-6.887%,345832221.00,United States,2020,748619,Health Care,Medical/Nursing Services
DCI,Donaldson Company Inc. Common Stock,$74.37,0.53,0.718%,8904476351.00,United States,,352541,Industrials,Pollution Control Equipment
DCO,Ducommun Incorporated Common Stock,$59.78,0.55,0.929%,881647037.00,United States,,34814,Industrials,Military/Government/Technical
DCOM,Dime Community Bancshares Inc. Common Stock,$29.69,-0.11,-0.369%,1162323033.00,United States,,142032,Finance,Major Banks
DCOMG,Dime Community Bancshares Inc. 9.000% Fixed-to-Floating Rate Subordinated Notes due 2034,$27.20,-0.01,-0.037%,1064842926.00,United States,,306,Finance,Major Banks
DCOMP,Dime Community Bancshares Inc. Fixed-Rate Non-Cumulative Perpetual Preferred Stock Series A,$20.42,0.0706,0.347%,799415168.00,United States,,6596,Finance,Major Banks
DCTH,Delcath Systems Inc. Common Stock,$10.77,0.27,2.571%,301554852.00,United States,,337284,Health Care,Medical/Dental Instruments
DD,DuPont de Nemours Inc. Common Stock,$81.85,-0.65,-0.788%,34171974999.00,United States,2017,2680890,Industrials,Major Chemicals
DDC,DDC Enterprise Limited Class A Ordinary Shares,$0.2117,0.0007,0.332%,4566369.00,,2023,191799,Consumer Staples,Packaged Foods
DDD,3D Systems Corporation Common Stock,$3.34,-0.05,-1.475%,446136412.00,United States,,1891782,Technology,Computer Software: Prepackaged Software
DDI,DoubleDown Interactive Co. Ltd. American Depository Shares,$14.65,0.10,0.687%,725957896.00,South Korea,2021,52793,Technology,EDP Services
DDL,Dingdong (Cayman) Limited American Depositary Shares (each two representing three Ordinary Shares),$3.76,0.04,1.075%,679958400.00,Cayman Islands,2021,1562685,Consumer Discretionary,Catalog/Specialty Distribution
DDOG,Datadog Inc. Class A Common Stock,$125.56,2.30,1.866%,39063016802.00,United States,2019,3294045,Technology,Computer Software: Prepackaged Software
DDS,Dillard's Inc. Common Stock,$380.95,10.88,2.94%,6163353098.00,United States,,120760,Consumer Discretionary,Department/Specialty Retail Stores
DDT,Dillard's Capital Trust I,$25.94,0.1999,0.777%,419680744.00,United States,,5317,Consumer Discretionary,Department/Specialty Retail Stores
DE,Deere & Company Common Stock,$401.68,1.26,0.315%,109899574894.00,United States,,801931,Industrials,Industrial Machinery/Components
DEA,Easterly Government Properties Inc. Common Stock,$13.48,0.11,0.823%,1388906435.00,United States,2015,889118,Real Estate,Real Estate Investment Trusts
DEC,Diversified Energy Company plc Ordinary Shares,$12.02,0.06,0.502%,588417464.00,,,159350,,
DECA,Denali Capital Acquisition Corp. Class A Ordinary Shares,$11.70,0.10,0.862%,0.00,United States,2022,5492,Finance,Blank Checks
DECAU,Denali Capital Acquisition Corp. Unit,$11.53,0.00,0.00%,0.00,United States,2022,9,Finance,Blank Checks
DECK,Deckers Outdoor Corporation Common Stock,$162.26,4.14,2.618%,24650861773.00,United States,1993,1950171,Consumer Discretionary,Shoe Manufacturing
DEI,Douglas Emmett Inc. Common Stock,$18.00,0.48,2.74%,3013369056.00,United States,2006,1682310,Real Estate,Real Estate Investment Trusts
DELL,Dell Technologies Inc. Class C Common Stock ,$129.85,-1.02,-0.779%,91204657970.00,United States,2018,10608792,Technology,Computer Manufacturing
DENN,Denny's Corporation Common Stock,$6.57,0.06,0.922%,337232148.00,United States,,728845,Consumer Discretionary,Restaurants
DEO,Diageo plc Common Stock,$123.57,-0.64,-0.515%,68738588994.00,United Kingdom,,624361,Consumer Staples,Beverages (Production/Distribution)
DERM,Journey Medical Corporation Common Stock,$5.32,-0.85,-13.776%,110268901.00,United States,2021,894718,Health Care,Biotechnology: Pharmaceutical Preparations
DESP,Despegar.com Corp. Ordinary Shares,$14.31,-0.25,-1.717%,1031095731.00,Argentina,2017,593217,Consumer Discretionary,Transportation Services
DFH,Dream Finders Homes Inc. Class A Common Stock,$30.96,0.21,0.683%,2894024174.00,United States,2022,340574,Consumer Discretionary,Homebuilding
DFIN,Donnelley Financial Solutions Inc. Common Stock ,$56.91,0.45,0.797%,1642322268.00,United States,2016,320289,Consumer Discretionary,Other Consumer Services
DFLI,Dragonfly Energy Holdings Corp. Common Stock (NV),$0.515,-0.0118,-2.24%,32234453.00,United States,2021,346548,Miscellaneous,Industrial Machinery/Components
DFLIW,Dragonfly Energy Holdings Corp. Warrant,$0.0269,0.0003,1.128%,1683702.00,United States,2021,5262,Miscellaneous,Industrial Machinery/Components
DFP,Flaherty & Crumrine Dynamic Preferred and Income Fund Inc. Common Stock,$20.36,0.09,0.444%,0.00,,2013,89392,Finance,Investment Managers
DFS,Discover Financial Services Common Stock,$149.14,-2.16,-1.428%,37444809476.00,United States,,1252103,Finance,Finance: Consumer Services
DG,Dollar General Corporation Common Stock,$82.00,0.24,0.294%,18033045088.00,United States,2009,4571090,Consumer Discretionary,Department/Specialty Retail Stores
DGHI,Digihost Technology Inc. Common Subordinate Voting Shares,$1.38,-0.07,-4.828%,45526200.00,Canada,,117197,Finance,Finance: Consumer Services
DGICA,Donegal Group Inc. Class A Common Stock,$15.12,-0.03,-0.198%,506272788.00,United States,,49901,Finance,Property-Casualty Insurers
DGICB,Donegal Group Inc. Class B Common Stock,$14.68,0.00,0.00%,491539982.00,United States,1986,66,Finance,Property-Casualty Insurers
DGII,Digi International Inc. Common Stock,$29.34,0.29,0.998%,1068421499.00,United States,1989,94725,Telecommunications,Computer Communications Equipment
DGLY,Digital Ally Inc. Common Stock,$1.04,0.07,7.216%,4009366.00,United States,,96450,Technology,Radio And Television Broadcasting And Communications Equipment
DGX,Quest Diagnostics Incorporated Common Stock,$154.33,-0.96,-0.618%,17225570884.00,United States,,554888,Health Care,Medical Specialities
DH,Definitive Healthcare Corp. Class A Common Stock,$4.08,-0.10,-2.392%,477862297.00,United States,2021,377806,Technology,Computer Software: Prepackaged Software
DHAI,DIH Holdings US Inc. Class A Common Stock,$1.38,0.00,0.00%,55952010.00,United States,2024,2969,Health Care,Medical/Dental Instruments
DHAIW,DIH Holding US Inc. Warrants,$0.044,0.004,10.00%,1783977.00,United States,2024,579,Health Care,Medical/Dental Instruments
DHC,Diversified Healthcare Trust Common Shares of Beneficial Interest,$3.52,0.05,1.441%,846822631.00,United States,,1248152,Real Estate,Real Estate Investment Trusts
DHCNI,Diversified Healthcare Trust 5.625% Senior Notes due 2042,$15.877,0.067,0.424%,3819603099.00,United States,,30191,Real Estate,Real Estate Investment Trusts
DHCNL,Diversified Healthcare Trust 6.25% Senior Notes Due 2046,$17.022,0.072,0.425%,4095061028.00,United States,,9490,Real Estate,Real Estate Investment Trusts
DHF,BNY Mellon High Yield Strategies Fund Common Stock,$2.57,0.00,0.00%,0.00,United States,1998,214095,Finance,Finance Companies
DHI,D.R. Horton Inc. Common Stock,$170.74,3.10,1.849%,55668085991.00,United States,,3411614,Consumer Discretionary,Homebuilding
DHIL,Diamond Hill Investment Group Inc. Class A Common Stock,$151.35,-2.03,-1.324%,416367331.00,United States,,7806,Finance,Investment Managers
DHR,Danaher Corporation Common Stock,$247.18,-0.58,-0.234%,178531969352.00,United States,,1836428,Industrials,Industrial Machinery/Components
DHT,DHT Holdings Inc.,$10.11,-0.19,-1.845%,1627705370.00,Jersey,2005,957677,Consumer Discretionary,Marine Transportation
DHX,DHI Group Inc. Common Stock,$1.68,-0.01,-0.592%,81318492.00,United States,2007,59722,Consumer Discretionary,Business Services
DHY,Credit Suisse High Yield Bond Fund Common Stock,$2.14,-0.01,-0.465%,0.00,United States,1998,197219,Finance,Finance/Investors Services
DIAX,Nuveen Dow 30SM Dynamic Overwrite Fund Common Shares of Beneficial Interest,$14.65,-0.03,-0.204%,0.00,,2014,65273,Finance,Finance Companies
DIBS,1stdibs.com Inc. Common Stock,$4.11,-0.03,-0.725%,163138797.00,United States,2021,64645,Consumer Discretionary,Catalog/Specialty Distribution
DIN,Dine Brands Global Inc. Common Stock,$29.85,-0.81,-2.642%,456675598.00,United States,,827685,Consumer Discretionary,Restaurants
DINO,HF Sinclair Corporation Common Stock,$39.01,0.31,0.801%,7339804176.00,United States,1960,1757184,Energy,Natural Gas Distribution
DIOD,Diodes Incorporated Common Stock,$60.19,0.03,0.05%,2788697860.00,United States,,250124,Technology,Semiconductors
DIS,Walt Disney Company (The) Common Stock,$95.79,-0.02,-0.021%,173723535130.00,United States,,6088036,Consumer Discretionary,Services-Misc. Amusement & Recreation
DIST,Distoken Acquisition Corporation Ordinary Shares,$10.98,0.01,0.091%,0.00,China,2023,45245,Finance,Blank Checks
DIT,AMCON Distributing Company Common Stock,$132.85,7.85,6.28%,83743592.00,United States,1999,261,Consumer Discretionary,Food Distributors
DJCO,Daily Journal Corp. (S.C.) Common Stock,$493.25,-0.18,-0.036%,679415375.00,United States,,16984,Consumer Discretionary,Newspapers/Magazines
DJT,Trump Media & Technology Group Corp. Common Stock,$34.34,3.78,12.369%,6686539610.00,United States,2024,120921603,Technology,Computer Software: Programming Data Processing
